{
  "schema": 1,
  "source": {
    "engine": "ce-review",
    "mode": "headless",
    "run_artifact": ".context/compound-engineering/ce-review/example-run/"
  },
  "base": "1111111111111111111111111111111111111111",
  "head": "2222222222222222222222222222222222222222",
  "personas": ["correctness-reviewer", "testing-reviewer"],
  "findings": [
    {
      "id": "F1",
      "severity": "P1",
      "title": "Missing empty-input check",
      "file": "src/example.mjs",
      "line": 42,
      "persona": "correctness-reviewer",
      "confidence": 0.8,
      "task": "T034",
      "disposition": "open",
      "reason": null
    },
    {
      "id": "F2",
      "severity": "P3",
      "title": "Consider a clearer name",
      "file": "src/example.mjs",
      "line": 57,
      "persona": "testing-reviewer",
      "confidence": 0.7,
      "disposition": "dismissed",
      "reason": "Existing public API requires this name"
    }
  ]
}
